{
  "format_version": "1.0",
  "generated_at": "2026-10-05T18:00:00-05:00",
  "course": "Block 2",
  "week": 6,
  "day_label": "Week 6 – Day 1 (Mon Oct 5)",
  "date": "2026-10-05",
  "lectures": [
    {
      "lecture_id": "B2-W6-D1-L1",
      "title": "Renal Tubular Physiology I",
      "lecturer": "Dr. Smith",
      "summary": "Covers the proximal convoluted tubule as the nephron's bulk reabsorber: about two-thirds of filtered Na+ and water and essentially all filtered glucose and amino acids are reclaimed there. Reviews the apical transporters (SGLT2, NHE3, Na+-phosphate cotransport) and the basolateral Na+/K+-ATPase that powers them, bicarbonate reclamation by carbonic anhydrase, and how angiotensin II and PTH regulate proximal transport. Clinical correlates include SGLT2 inhibitors, acetazolamide, and Fanconi syndrome.",
      "learning_objectives": [
        "Describe Na+ handling in the PCT and the fraction of the filtered load reabsorbed there",
        "Explain glucose reabsorption by SGLT2/SGLT1 and the concept of transport maximum",
        "Describe bicarbonate reabsorption in the PCT and the role of carbonic anhydrase",
        "Explain the effects of angiotensin II and PTH on PCT transport",
        "Predict the findings of generalized proximal tubule dysfunction (Fanconi syndrome)"
      ]
    },
    {
      "lecture_id": "B2-W6-D1-L2",
      "title": "Glomerular Filtration and Renal Clearance",
      "lecturer": "Dr. Patel",
      "summary": "Introduces the Starling forces that drive glomerular filtration and how afferent and efferent arteriolar tone change GFR, renal plasma flow, and filtration fraction. Defines clearance and shows how inulin (or creatinine) clearance estimates GFR and PAH clearance estimates effective renal plasma flow. Applies these concepts to drugs that alter glomerular hemodynamics, such as ACE inhibitors and NSAIDs.",
      "learning_objectives": [
        "Describe the Starling forces governing glomerular filtration",
        "Predict the effects of afferent and efferent arteriolar constriction and dilation on GFR, RPF, and filtration fraction",
        "Calculate GFR from inulin or creatinine clearance",
        "Calculate renal plasma flow and renal blood flow from PAH clearance and hematocrit",
        "Explain how ACE inhibitors and NSAIDs alter glomerular hemodynamics"
      ]
    }
  ],
  "questions": [
    {
      "qid": "B2-W6-D1-L1-Q001",
      "lecture_id": "B2-W6-D1-L1",
      "type": "clinical_vignette",
      "difficulty": 2,
      "stem": "A 58-year-old man with type 2 diabetes mellitus and heart failure with reduced ejection fraction is started on empagliflozin. Two weeks later, his urinalysis shows 3+ glucose; his fasting plasma glucose is 132 mg/dL. Inhibition of which of the following transporters is most directly responsible for his glucosuria?",
      "options": [
        { "id": "A", "text": "GLUT2 on the basolateral membrane of proximal tubule cells", "explanation": "GLUT2 moves reabsorbed glucose out of the cell into the interstitium by facilitated diffusion. It is not the drug target; gliflozins act on apical Na+-coupled entry, not basolateral exit." },
        { "id": "B", "text": "Na+/glucose cotransporter 1 (SGLT1) in the late proximal tubule", "explanation": "SGLT1 is a high-affinity, low-capacity transporter in the S3 segment that recovers the remaining ~10% of filtered glucose; it is also the main intestinal glucose transporter. Empagliflozin is highly selective for SGLT2 over SGLT1." },
        { "id": "C", "text": "Na+/glucose cotransporter 2 (SGLT2) in the early proximal convoluted tubule", "explanation": "Correct. SGLT2 is a high-capacity, low-affinity transporter in the S1–S2 segments that reclaims about 90% of filtered glucose. Empagliflozin blocks it, so glucose is excreted even at modest plasma levels." },
        { "id": "D", "text": "Na+-K+-2Cl− cotransporter (NKCC2) in the thick ascending limb", "explanation": "NKCC2 is the target of loop diuretics such as furosemide. It does not transport glucose." },
        { "id": "E", "text": "Na+-Cl− cotransporter (NCC) in the distal convoluted tubule", "explanation": "NCC is the target of thiazide diuretics. It does not transport glucose, and by the DCT essentially all filtered glucose has normally already been reclaimed." }
      ],
      "correct_option": "C",
      "explanation": "Filtered glucose is reabsorbed almost entirely in the proximal tubule by secondary active transport: apical Na+-glucose cotransporters use the Na+ gradient created by the basolateral Na+/K+-ATPase, and glucose leaves the cell basolaterally through GLUT transporters. SGLT2 in the early PCT does most of the work, and SGLT1 in the late PCT recovers the rest. SGLT2 inhibitors (the -gliflozins) lower the renal threshold for glucose, causing glucosuria and an osmotic diuresis that lowers plasma glucose, blood pressure, and volume; they also reduce heart failure hospitalizations and slow CKD progression. Their adverse effects follow from the mechanism: genital mycotic infections and UTIs, volume depletion, and euglycemic DKA.",
      "key_takeaway": "SGLT2 in the early PCT reabsorbs ~90% of filtered glucose; -gliflozins block it and cause glucosuria.",
      "source": { "slides": "8-10", "objective": "Explain glucose reabsorption by SGLT2/SGLT1 and the concept of transport maximum" },
      "tags": ["renal", "physiology", "pharmacology", "PCT", "glucose"],
      "image_url": null
    },
    {
      "qid": "B2-W6-D1-L1-Q002",
      "lecture_id": "B2-W6-D1-L1",
      "type": "lab_interpretation",
      "difficulty": 3,
      "stem": "A 4-year-old boy is evaluated for poor growth and bowing of the legs. Urinalysis shows 2+ glucose, and amino acids are detected in the urine. Laboratory studies show:\n\nSerum glucose: 88 mg/dL (70–100)\nSerum phosphate: 2.1 mg/dL (4.0–6.5 for age)\nSerum bicarbonate: 16 mEq/L (22–28)\nSerum chloride: 112 mEq/L (98–107)\nSerum potassium: 3.2 mEq/L (3.5–5.0)\n\nDysfunction of which of the following nephron segments best explains these findings?",
      "options": [
        { "id": "A", "text": "Glomerulus", "explanation": "Glomerular disease causes proteinuria (nephrotic pattern) or hematuria with reduced GFR (nephritic pattern). It does not cause selective urinary loss of glucose, amino acids, phosphate, and bicarbonate with a normal serum glucose." },
        { "id": "B", "text": "Proximal convoluted tubule", "explanation": "Correct. The PCT reabsorbs virtually all filtered glucose and amino acids, most filtered phosphate, and about 80% of filtered bicarbonate. Generalized PCT dysfunction (Fanconi syndrome) wastes all of them at once." },
        { "id": "C", "text": "Thick ascending limb of the loop of Henle", "explanation": "Thick ascending limb defects (e.g., Bartter syndrome) cause salt wasting, hypokalemia, and metabolic alkalosis with hypercalciuria, not glucosuria, aminoaciduria, or acidosis." },
        { "id": "D", "text": "Distal convoluted tubule", "explanation": "DCT defects (e.g., Gitelman syndrome) cause hypokalemia, metabolic alkalosis, hypomagnesemia, and hypocalciuria. The DCT does not handle glucose or amino acids." },
        { "id": "E", "text": "α-Intercalated cells of the collecting duct", "explanation": "Defective H+ secretion here causes distal (type 1) RTA: a non-anion gap acidosis with an inappropriately high urine pH (>5.5) and nephrolithiasis, but no glucosuria, aminoaciduria, or phosphate wasting." }
      ],
      "correct_option": "B",
      "explanation": "Glucosuria with a normal serum glucose means the problem is tubular reabsorption, not filtered load. Add aminoaciduria, phosphate wasting (hypophosphatemia leading to rickets, which explains the leg bowing), and a hyperchloremic (non-anion gap) metabolic acidosis from bicarbonate wasting, and the picture is Fanconi syndrome: generalized failure of proximal tubule reabsorption. The bicarbonate wasting is a proximal (type 2) RTA. Hypokalemia results from increased distal delivery of Na+ and fluid, which drives K+ secretion. In children, think cystinosis; in adults, think multiple myeloma light chains, drugs (ifosfamide, tenofovir, expired tetracyclines), Wilson disease, and lead poisoning.",
      "key_takeaway": "Glucosuria + aminoaciduria + phosphaturia + non-anion gap acidosis with a normal serum glucose = Fanconi syndrome (generalized PCT failure).",
      "source": { "slides": "22-24", "objective": "Predict the findings of generalized proximal tubule dysfunction (Fanconi syndrome)" },
      "tags": ["renal", "physiology", "PCT", "Fanconi", "acid-base"],
      "image_url": null
    },
    {
      "qid": "B2-W6-D1-L1-Q003",
      "lecture_id": "B2-W6-D1-L1",
      "type": "recall",
      "difficulty": 1,
      "stem": "In a healthy adult on a normal-sodium diet, approximately what fraction of the filtered load of Na+ is reabsorbed in the proximal convoluted tubule?",
      "options": [
        { "id": "A", "text": "About 3%", "explanation": "This is roughly the fraction reabsorbed in the collecting duct, where aldosterone fine-tunes Na+ balance through ENaC." },
        { "id": "B", "text": "About 5%", "explanation": "This is roughly the fraction reabsorbed in the distal convoluted tubule through NCC, the thiazide target." },
        { "id": "C", "text": "About 25%", "explanation": "This is roughly the fraction reabsorbed in the thick ascending limb through NKCC2, the loop diuretic target." },
        { "id": "D", "text": "About 67%", "explanation": "Correct. The PCT reabsorbs about two-thirds of filtered Na+ and water isosmotically." },
        { "id": "E", "text": "About 99%", "explanation": "This is roughly the fraction of filtered Na+ reabsorbed by the whole nephron; normally less than 1% of the filtered load is excreted (FENa < 1%)." }
      ],
      "correct_option": "D",